by,descendants,id,score,time,title,type,url,text,domain
gmays,67,47218743,341,1772463298,First in-utero stem cell therapy for fetal spina bifida repair is safe: study,story,https://health.ucdavis.edu/news/headlines/first-ever-in-utero-stem-cell-therapy-for-fetal-spina-bifida-repair-is-safe-study-finds/2026/02,,health.ucdavis.edu
gradus_ad,105,47207404,320,1772377795,New iron nanomaterial wipes out cancer cells without harming healthy tissue,story,https://www.sciencedaily.com/releases/2026/02/260228093456.htm,,sciencedaily.com
ppnpm,21,47187649,117,1772235734,Qt45: A small polymerase ribozyme that can synthesize itself,story,https://www.science.org/doi/10.1126/science.adt2760,,science.org
jbdamask,131,47195123,299,1772285376,Show HN: Now I Get It – Translate scientific papers into interactive webpages,story,https://nowigetit.us,"Understanding scientific articles can be tough, even in your own field. Trying to comprehend articles from others? Good luck.<p>Enter, Now I Get It!<p>I made this app for curious people. Simply upload an article and after a few minutes you&#x27;ll have an interactive web page showcasing the highlights. Generated pages are stored in the cloud and can be viewed from a gallery.<p>Now I Get It! uses the best LLMs out there, which means the app will improve as AI improves.<p>Free for now - it&#x27;s capped at 20 articles per day so I don&#x27;t burn cash.<p>A few things I (and maybe you will) find interesting:<p>* This is a pure convenience app. I could just as well use a saved prompt in Claude, but sometimes it&#x27;s nice to have a niche-focused app. It&#x27;s just cognitively easier, IMO.<p>* The app was built for myself and colleagues in various scientific fields. It can take an hour or more to read a detailed paper so this is like an on-ramp.<p>* The app is a place for me to experiment with using LLMs to translate scientific articles into software. The space is pregnant with possibilities.<p>* Everything in the app is the result of agentic engineering, e.g. plans, specs, tasks, execution loops. I swear by Beads (<a href=""https:&#x2F;&#x2F;github.com&#x2F;steveyegge&#x2F;beads"" rel=""nofollow"">https:&#x2F;&#x2F;github.com&#x2F;steveyegge&#x2F;beads</a>) by Yegge and also make heavy use of Beads Viewer (<a href=""https:&#x2F;&#x2F;news.ycombinator.com&#x2F;item?id=46314423"">https:&#x2F;&#x2F;news.ycombinator.com&#x2F;item?id=46314423</a>) and Destructive Command Guard (<a href=""https:&#x2F;&#x2F;news.ycombinator.com&#x2F;item?id=46835674"">https:&#x2F;&#x2F;news.ycombinator.com&#x2F;item?id=46835674</a>) by Jeffrey Emanuel.<p>* I&#x27;m an AWS fan and have been impressed by Opus&#x27; ability to write good CFN. It still needs a bunch of guidance around distributed architecture but way better than last year.",nowigetit.us
voxadam,331,47182483,293,1772210019,"NASA announces overhaul of Artemis program amid safety concerns, delays",story,https://www.cbsnews.com/news/nasa-artemis-moon-program-overhaul/,,cbsnews.com
simonebrunozzi,150,47181841,212,1772207073,ChatGPT Health fails to recognise medical emergencies – study,story,https://www.theguardian.com/technology/2026/feb/26/chatgpt-health-fails-recognise-medical-emergencies,,theguardian.com
gradus_ad,100,47202734,106,1772329437,Just two days of oatmeal cut bad cholesterol by 10%,story,https://www.sciencedaily.com/releases/2026/02/260225081217.htm,,sciencedaily.com
