by,descendants,id,score,time,title,type,url,text,domain
worldvoyageur,15,31874387,72,1656156921,Frozen baby woolly mammoth discovered in Yukon gold fields,story,https://www.cbc.ca/news/canada/north/frozen-whole-baby-woolly-mammoth-yukon-gold-fields-1.6501128,,cbc.ca
chkas,17,31883209,48,1656245222,Show HN: Particles – the URL contains the whole program code,story,https://easylang.online/run/?code=%23%20Particles%0A%23%20%0An_part%20%3D%2040%0Athres%20%3D%2015%0A%23%20%0Asubr%20connect%0A%20%20h%20%3D%20dx%20*%20dx%20%2B%20dy%20*%20dy%0A%20%20dist%20%3D%20sqrt%20h%0A%20%20if%20dist%20%3C%20thres%0A%20%20%20%20lw%20%3D%20(thres%20-%20dist)%20%2F%2030%0A%20%20%20%20linewidth%20lw%0A%20%20%20%20move%20px%20py%0A%20%20%20%20line%20px%5Bj%5D%20py%5Bj%5D%0A%20%20.%0A.%0Aon%20animate%0A%20%20clear%0A%20%20for%20i%20range%20n_part%0A%20%20%20%20px%20%3D%20px%5Bi%5D%0A%20%20%20%20py%20%3D%20py%5Bi%5D%0A%20%20%20%20move%20px%20py%0A%20%20%20%20circle%200.3125%0A%20%20%20%20for%20j%20range%20i%0A%20%20%20%20%20%20dx%20%3D%20abs%20(px%5Bj%5D%20-%20px)%0A%20%20%20%20%20%20if%20dx%20%3C%20thres%0A%20%20%20%20%20%20%20%20dy%20%3D%20abs%20(py%5Bj%5D%20-%20py)%0A%20%20%20%20%20%20%20%20if%20dy%20%3C%20thres%0A%20%20%20%20%20%20%20%20%20%20call%20connect%0A%20%20%20%20%20%20%20%20.%0A%20%20%20%20%20%20.%0A%20%20%20%20.%0A%20%20%20%20if%20px%20%3E%20100%20or%20px%20%3C%200%0A%20%20%20%20%20%20pvx%5Bi%5D%20%3D%20-pvx%5Bi%5D%0A%20%20%20%20.%0A%20%20%20%20if%20py%20%3E%20100%20or%20py%20%3C%200%0A%20%20%20%20%20%20pvy%5Bi%5D%20%3D%20-pvy%5Bi%5D%0A%20%20%20%20.%0A%20%20%20%20px%5Bi%5D%20%2B%3D%20pvx%5Bi%5D%0A%20%20%20%20py%5Bi%5D%20%2B%3D%20pvy%5Bi%5D%0A%20%20.%0A.%0Afor%20i%20range%20n_part%0A%20%20px%5B%5D%20%26%3D%20randomf%20*%20100%0A%20%20py%5B%5D%20%26%3D%20randomf%20*%20100%0A%20%20pvx%5B%5D%20%26%3D%20(0.5%20-%20randomf)%20%2F%203%0A%20%20pvy%5B%5D%20%26%3D%20(0.5%20-%20randomf)%20%2F%203%0A.%0A,,easylang.online
diodorus,17,31876379,78,1656173341,Archaeologist discovers 6k year-old island settlement off Croatian coast (2021),story,https://www.reuters.com/lifestyle/science/archaeologist-discovers-6000-year-old-island-settlement-off-croatian-coast-2021-06-24/,,reuters.com
lando2319,10,31882961,54,1656242757,"Explorers find WWII Navy destroyer, deepest wreck discovered",story,https://apnews.com/article/science-world-war-ii-philippines-manila-us-navy-738704ff8c2ab31bbf5cadd01cfd36d3,,apnews.com
prostoalex,83,31857210,136,1656037758,The fragmented nature of modern-day railways,story,https://hackaday.com/2022/06/23/grain-stuck-in-the-ukraine-the-fragmented-nature-of-modern-day-railways/,,hackaday.com
PaulHoule,4,31885702,28,1656263234,Study: Flu vaccination linked to 40% reduced risk of Alzheimer's disease,story,https://medicalxpress.com/news/2022-06-flu-vaccination-linked-alzheimer-disease.html,,medicalxpress.com
echen,262,31858063,283,1656048027,"‘Anti-hunger’ molecule forms after exercise, scientists discover",story,https://med.stanford.edu/news/all-news/2022/06/anti-hunger-molecule-exercise.html,,med.stanford.edu
gmays,19,31862464,117,1656080980,Link found between immune system and hair growth,story,https://www.salk.edu/news-release/hair-raising-research-salk-scientists-find-surprising-link-between-immune-system-hair-growth/,,salk.edu
deathgripsss,78,31854347,243,1656014003,One centimeter long bacterium discovered,story,https://www.science.org/doi/10.1126/science.abb3634,,science.org
rbanffy,19,31870037,71,1656108291,Computer Simulations of Proteins Help Unravel Why Chemotherapy Resistance Occurs,story,https://news.stonybrook.edu/university/computer-simulations-of-proteins-help-unravel-why-chemotherapy-resistance-occurs-2/,,news.stonybrook.edu
localhost,19,31864085,62,1656085709,Computer History Museum Interview with David Cutler (2018) [video],story,https://www.youtube.com/watch?v=29RkHH-psrY,,youtube.com
gjvc,0,31848440,31,1655989227,Suzieq – Healthier Networks Through Network Observability,story,https://github.com/netenglabs/suzieq,,github.com
diodorus,22,31872155,89,1656126276,A mystery that took 13k years to crack,story,https://www.theatlantic.com/science/archive/2022/06/mastodon-mammoth-extinction-climate-change/661351/,,theatlantic.com
flave,114,31846529,147,1655973964,"Vaccine-derived poliovirus type 2 detected in London, UK",story,https://www.who.int/news/item/22-06-2022-vaccine-derived-poliovirus-type-2-(vdpv2)-detected-in-environmental-samples-in-london--uk,,who.int
Gatsky,62,31844406,155,1655950283,U.S. plans trial of early detection blood tests for multiple cancers,story,https://www.science.org/content/article/complexities-are-staggering-u-s-plans-huge-trial-blood-tests-multiple-cancers,,science.org
sohkamyung,5,31879501,17,1656198614,"On NetHack's 35th Anniversary, It's Displayed at Museum of Modern Art",story,https://games.slashdot.org/story/22/06/25/1927234/on-nethacks-35th-anniversary-its-displayed-at-museum-of-modern-art,,games.slashdot.org
KasianFranks,46,31845868,144,1655966627,Cancer cells wake up when people sleep,story,https://www.nature.com/articles/d41586-022-01724-w,,nature.com
mastazi,214,31831115,142,1655861937,Alphabet is spending billions to become a force in health care,story,https://www.economist.com/business/2022/06/20/alphabet-is-spending-billions-to-become-a-force-in-health-care,,economist.com
pawelwentpawel,64,31833415,163,1655887097,Show HN: I built a fun video meeting app with 2D physics and proximity chat,story,https://flat.social,"Hi HN!<p><a href=""https:&#x2F;&#x2F;flat.social"" rel=""nofollow"">https:&#x2F;&#x2F;flat.social</a> is a web video meeting app for organising fun online meetings &amp; social events. Each participant can move around and talk with others in their proximity.<p>Here is a quick demo if you wanna see it in action: <a href=""https:&#x2F;&#x2F;youtu.be&#x2F;Y2yH3twjrx4"" rel=""nofollow"">https:&#x2F;&#x2F;youtu.be&#x2F;Y2yH3twjrx4</a><p>I’ve been on it solo for around a year right now. Tech used is Next.js, Typescript, PIXI.js on the front-end and Node, Mediasoup, Socket.io and Matter.js (physics engine) on the backend.<p>Feel free to jump in into the demo room (<a href=""https:&#x2F;&#x2F;flat.social&#x2F;f&#x2F;Flat.Social-Demo"" rel=""nofollow"">https:&#x2F;&#x2F;flat.social&#x2F;f&#x2F;Flat.Social-Demo</a>) to say hi, I’ll be hanging out there throughout today.<p>Would love to hear your thoughts on it!",flat.social
remflight,3,31872211,23,1656126869,Pig heart transplant failure: Doctors detail everything that went wrong,story,https://arstechnica.com/science/2022/06/pig-heart-transplant-failed-as-its-heart-muscle-cells-died/,,arstechnica.com
