by,descendants,id,score,time,title,type,url,text,domain
ZainRiz,66,28394752,121,1630603159,Experiments on a $50 DIY air purifier you can make in 30s,story,https://dynomight.net/2020/12/15/some-real-data-on-a-DIY-box-fan-air-purifier/,,dynomight.net
samizdis,36,28394517,76,1630602115,Sacklers granted lifetime legal immunity in opioid settlement,story,https://arstechnica.com/science/2021/09/billionaire-sacklers-granted-lifetime-legal-immunity-in-opioid-settlement/,,arstechnica.com
hheikinh,309,28381108,170,1630510251,"Israel’s Covid-19 boosters are preventing infections, new studies suggest",story,https://www.science.org/content/article/israel-s-covid-19-boosters-are-preventing-infections-new-studies-suggest,,science.org
matt_d,92,28374523,184,1630449678,It's Time for Operating Systems to Rediscover Hardware,story,https://www.usenix.org/conference/osdi21/presentation/fri-keynote,,usenix.org
gmays,84,28380532,172,1630507852,Rogue antibodies involved in almost one-fifth of Covid deaths,story,https://www.nature.com/articles/d41586-021-02337-5,,nature.com
walterbell,26,28381581,65,1630512272,Japan finds stainless steel particles in suspended doses of Moderna vaccine,story,https://www.reuters.com/business/healthcare-pharmaceuticals/japan-finds-stainless-steel-particles-suspended-doses-moderna-vaccine-2021-09-01/,,reuters.com
tosh,12,28367489,42,1630414851,William Faulkner's Nobel Prize in Literature Acceptance Speech (1949),story,https://www.nobelprize.org/prizes/literature/1949/faulkner/speech/,,nobelprize.org
hiddencache,143,28367524,197,1630414996,Toxic ‘forever chemicals’ contaminate indoor air at worrying levels,story,https://www.theguardian.com/society/2021/aug/31/pfas-toxic-forever-chemicals-air-breathing,,theguardian.com
tomhoward,42,28381430,39,1630511796,Travel agencies are having a moment amid Covid-19,story,https://www.wsj.com/articles/travel-advisers-delta-covid-11630442498,,wsj.com
rodrigo975,5,28370866,57,1630430596,RSA/SHA1 signature type disabled by default in OpenSSH,story,https://undeadly.org/cgi?action=article;sid=20210830113413,,undeadly.org
underscore_ku,1,28384089,16,1630522340,Scientists warn glacier in Canadian Rockies slipping away at unprecedented rate,story,https://globalnews.ca/news/8154343/canadian-rockies-glacier-melt/,,globalnews.ca
rmason,31,28371397,50,1630433138,"On the front lines, here’s what the seven stages of severe Covid-19 look like",story,https://www.latimes.com/opinion/story/2021-08-26/pandemic-covid-19-stages-vaccination-intensive-care-respiratory-therapist,,latimes.com
Abishek_Muthian,14,28379718,21,1630503961,Tell HN: Amazon Kindle's browser is not experimental anymore,story,,"Amazon has made some major UI changes with the latest Kindle firmware 5.13.7, the browser has finally moved out of experimental status and is now just called Web Browser.<p>Amazon&#x27;s official change log for Kindle software updates is useless as always and so there&#x27;s no real technical information on what has changed with the browser but it does seem bit more responsive, So does other parts of Kindle.<p>I read HN on my Kindle and JS rich sites like TechCrunch wouldn&#x27;t load properly in the earlier Kindle experimental browser but loads great now (incl. Article mode).",
tdullien,0,28380430,20,1630507313,The mystery of Kubelet eating (too much) CPU and IOPS,story,https://prodfiler.com/blog/the-mystery-of-kubelet-eating-cpu-and-iops/,,prodfiler.com
AndrewBissell,231,28385661,297,1630531290,The Sackler Family Wins Immunity from Future Opioid Lawsuits,story,https://www.npr.org/2021/09/01/1031053251/sackler-family-immunity-purdue-pharma-oxcyontin-opioid-epidemic,,npr.org
danboarder,3,28375525,36,1630459097,Scientists Find 30-40 Minutes of Exercise Needed to 'Offset' a Day of Sitting,story,https://www.sciencealert.com/scientists-figured-out-how-much-exercise-you-need-to-offset-a-day-of-inactivity/,,sciencealert.com
pessimizer,1,28372281,22,1630437534,Johnson and Johnson’s HIV vaccine fails first efficacy trial,story,https://www.statnews.com/2021/08/31/first-efficacy-trial-of-johnson-johnsons-hiv-vaccine-fails/,,statnews.com
sva_,9,28385057,29,1630527491,"Reddit enforces policy about 'Covid denialism' – bans 1 sub, quarantines 54 more",story,https://www.reddit.com/r/redditsecurity/comments/pfyqqn/covid_denialism_and_policy_clarifications/,,reddit.com
toomuchtodo,13,28384557,15,1630524723,Reddit Admins: Covid denialism and policy clarifications,story,https://www.reddit.com/r/announcements/comments/pg006s/covid_denialism_and_policy_clarifications/,,reddit.com
AndrewBissell,0,28383305,19,1630518798,Long Covid in children 'nowhere near scale feared',story,https://www.bbc.co.uk/news/health-58410584,,bbc.co.uk
e2e4,5,28365135,16,1630397625,Facebook's experimental performance oriented greenfield implementation of Python,story,https://github.com/facebookexperimental/skybison,,github.com
nanis,0,28372229,14,1630437267,Two top vaccine regulators to leave U.S. FDA,story,https://www.reuters.com/business/healthcare-pharmaceuticals/two-top-vaccine-regulators-leave-us-fda-2021-08-31/,,reuters.com
TrueJane,36,28356781,75,1630338142,The Unsolved Mystery of the D-Day Puzzles,story,https://www.history.co.uk/articles/the-unsolved-mystery-of-the-d-day-puzzles,,history.co.uk
pseudolus,2,28371831,13,1630435100,Arizona launches a bold new experiment to limit racist convictions,story,https://www.vox.com/22648651/arizona-jury-race-batson-kentucky-peremptory-strikes-challenges-thurgood-marshall,,vox.com
boffinism,82,28370887,73,1630430686,Fake Banksy NFT sold through artist's website for £244k,story,https://www.bbc.co.uk/news/technology-58399338,,bbc.co.uk
