by,descendants,id,score,time,title,type,url,text,domain
apsec112,11,26576173,54,1616642007,The Database of Useful Biological Numbers,story,https://bionumbers.hms.harvard.edu/search.aspx,,bionumbers.hms.harvard.edu
clouddrover,7,26565999,32,1616587000,Manganese-rich cathode chemistries: The once and future king?,story,https://cellsiders.substack.com/p/manganese-rich-cathode-chemistries,,cellsiders.substack.com
SEJeff,260,26563090,292,1616554912,Multiple US Navy destroyers swarmed by mysterious 'drones' off California coast,story,https://www.thedrive.com/the-war-zone/39913/multiple-destroyers-were-swarmed-by-mysterious-drones-off-california-over-numerous-nights?xid=twittershare,,thedrive.com
magoghm,0,26584316,12,1616700227,Scientists create a lifelike material that has metabolism and can self-reproduce,story,https://bigthink.com/surprising-science/scientists-create-a-lifelike-material-that-has-metabolism-and-can-self-reproduce,,bigthink.com
adrian_mrd,2,26573577,27,1616623432,Thread on Facebook’s PR Tactics Against Karen Hao’s TechnologyReview Article,story,https://twitter.com/glichfield/status/1370740234288295936,,twitter.com
clumsysmurf,3,26572174,27,1616615967,Evidence of Fracking Chemicals Found in Bodies of Pennsylvania Children,story,https://truthout.org/articles/evidence-of-fracking-chemicals-found-in-bodies-of-pennsylvania-children/,,truthout.org
camjohnson26,8,26587426,17,1616718094,Elon Musk Is a Con Artist: Tesla’s Full Self-Driving Scam Revisited,story,https://vimeo.com/529045650,,vimeo.com
_Microft,0,26565272,11,1616579725,Pfizer is now testing a Covid-19 pill,story,https://thehill.com/changing-america/well-being/prevention-cures/544575-pfizer-is-now-testing-a-covid-19-pill,,thehill.com
reddotX,137,26565738,62,1616584658,Italian authorities discover 29M Oxford/AstraZeneca doses: La Stampa,story,https://www.politico.eu/article/italian-authorities-discover-29m-oxford-astrazeneca-vaccine-doses-la-stampa/,,politico.eu
